{
  "schema": "cap.validation_result.v1",
  "digestId": "cap-digest-basic-table",
  "fingerprint": "structure_v1:orders-1000x4",
  "ok": true,
  "errors": [],
  "warnings": [],
  "normalizedResponse": {
    "claims": [],
    "evidence": [],
    "warnings": [],
    "requests": [
      {
        "fieldId": "f1:table@sample#k10",
        "level": 1,
        "budget": 300,
        "reason": "Need sample rows before commenting on values."
      }
    ]
  }
}
